objectid,title,tagline,description,url,last_update,created,item_count,featured,status,search_index,categories,type,media_types,location,latitude,longitude,date_start,date_end,notes,old_image,featured_image,image_small,image_thumb,image_alt_text,image_source,data_location,repository_location,cdmid
pses,"Plant, Soil, and Entomological Sciences Records",,"Materials from the Plant, Soil, and Entomological Sciences records show images of a variety of insects and parasites which were photographed between the mid-1930s and the mid-1960s. They were photographed for research purposes by the College of Agriculture and Life Sciences at the University of Idaho.",https://www.lib.uidaho.edu/digital/pses/,2024-09,2024-09,56,,published,true,Idaho; Etymology; Science,,images,"Twin Falls, Idaho",42.562786,-114.460503,1935,1966,,https://www.lib.uidaho.edu/media/digital/small/pses.jpg,,,,A black and white still photograph of two ash-gray blister beetles on damaged sugar beet leaf.,https://objects.lib.uidaho.edu/pses/pses_014.jpg,https://www.lib.uidaho.edu/digital/pses/assets,https://github.com/uidaholib/base-digital-collections-template/tree/pses,
phs,Potlatch Historical Society Collection,,"Potlatch Historical Society Collection Depicting life in and around Potlatch, Idaho from 1880 to 1998",https://www.lib.uidaho.edu/digital/phs/,2023-12,2023-12,1781,,published,true,"Idaho; Northwest; Forests; Wilderness; Fire; Latah County; Potlatch, ID",,documents; images,Idaho,46.921048,-116.903855,1880,1998,,https://www.lib.uidaho.edu/media/digital/small/phs.jpg,,,,Longest Logging Train,https://objects.lib.uidaho.edu/phs/phs1810.jpg,https://www.lib.uidaho.edu/digital/phs/assets,https://github.com/uidaholib/base-digital-collections-template/tree/phs,"phs"
plcphotos,Potlatch Lumber Company Photograph Collection,,A collection of over 1500 photographs from the Potlatch Lumber Company,https://www.lib.uidaho.edu/digital/plcphotos/,2023-12,2023-12,1570,,published,true,"Idaho; Northwest; Forests; Wilderness; Fire; Latah County; Potlatch, ID",,images,Idaho,46.921048,-116.903855,1896,1999,,https://www.lib.uidaho.edu/media/digital/small/plcphotos.jpg,,,,"White Pine King, 1911",https://www.lib.uidaho.edu/digital/plcphotos/items/plcphotos16.html,https://www.lib.uidaho.edu/digital/plcphotos/assets,https://github.com/uidaholib/base-digital-collections-template/tree/plcphotos,"plcphotos"
priestlake,Priest Lake Historical Photograph Collection,,"A digital collection comprised of 380 historical photographs of Priest Lake, Idaho and the surrounding area. The images span the years 1880 to 1950, documenting the area&apos;s waters, boats, buildings, landscape and people.",https://www.lib.uidaho.edu/digital/priestlake/,2023-12,2023-12,380,,published,true,Idaho; Northwest; Water; Forests,,images,"Priest Lake, ID; Upper Priest Lake, ID; Priest River, ID; Coolin, ID; Idaho;",48.514088,-116.871872,1880,1950,,https://www.lib.uidaho.edu/media/digital/small/priestlake.jpg,,,,Dewey Huot&apos;s Mama,https://www.lib.uidaho.edu/digital/priestlake/items/priestlake370.html,https://www.lib.uidaho.edu/digital/priestlake/assets,https://github.com/uidaholib/base-digital-collections-template/tree/priestlake,"priestlake"
bukvich,Professor Daniel Bukvich Composition Collection,,"A collection of scores, sketches, parts, and auxiliary material produced by University of Idaho Lionel Hampton School of Music Composition Professor Daniel Bukvich.",https://www.lib.uidaho.edu/digital/bukvich/,2022-12,2022-12,28,,published,,U of I; Idaho; Music; Jazz; Composition,,documents,"University of Idaho; Moscow, ID;",46.72732,-117.01388,1986,2022,,https://www.lib.uidaho.edu/media/digital/small/bukvich.jpg,,,,In Memoriam Dresden score,https://www.lib.uidaho.edu/digital/bukvich/items/bukvich0021.html,https://www.lib.uidaho.edu/digital/bukvich/assets,https://github.com/uidaholib/bukvich-project,
psychiana,Psychiana Digital Collection,,"Materials from the Frank B. Robinson Papers documenting Psychiana, a religion popular in the 1930s and 40s",https://www.lib.uidaho.edu/digital/psychiana/,2024-02,2024-02,1323,true,published,true,Idaho; Northwest; Latah County; Religion,,images; documents; audio,"Moscow, ID",46.733711,-117.001252,1930,1952,,https://www.lib.uidaho.edu/media/digital/small/psychiana.jpg,,,,Photograph of Clerical and Bookkeeping Staff from the Branch Mailing Department.,https://objects.lib.uidaho.edu/psychiana/psychiana548.jpg,https://www.lib.uidaho.edu/digital/psychiana/assets,https://github.com/uidaholib/documents-digital-collections-template/tree/psychiana,"psychiana"
rangecoll,Rangeland Center Collection,,"The Rangeland Center collection is a repository of information created by University of Idaho researchers related to topics in rangeland ecology and management. Subject areas include ecology of rangelands, grazing management, invasive plants, fire ecology, and more.",https://www.lib.uidaho.edu/digital/rangecoll/,2023-12,2023-12,68,,published,true,U of I; Research; Northwest; Rangeland,,documents,Idaho,43.207053,-115.065308,1969,2013,,https://www.lib.uidaho.edu/media/digital/small/rangecoll.jpg,,,,Rangeland,https://www.lib.uidaho.edu/digital/images/rangelandarchive.jpg,https://www.lib.uidaho.edu/digital/rangecoll/assets,https://github.com/uidaholib/documents-digital-collections-template/tree/rangecoll,"rangecoll"
brown_ray,Ray Brown Collection,,"A small collection of the photographs and awards of Ray Brown, a renowned jazz double bassist and cellist.",https://www.ijc.uidaho.edu/brown_ray/,2023-12,2023-12,17,,published,true,IJC; Jazz,International Jazz Collections,images,"University of Idaho (Library); Moscow, ID;",46.7274,-117.01404,1953,2001,,https://www.lib.uidaho.edu/media/digital/small/brown_ray.jpg,,,,Ray Brown,https://objects.lib.uidaho.edu/ijc/brown_ray/ijc_ray_brown_008.jpg,https://www.ijc.uidaho.edu/brown_ray/assets,https://github.com/uidaholib/ijc-collection-template/tree/brown_ray,"ijc_brown"
dodson,Richard W. Dodson Collection of Science Fiction,,"Correspondence between Richard W. Dodson, Edward E. (""Doc"") Smith, and other science fiction authors of the 20th century",https://www.lib.uidaho.edu/digital/dodson/,2023-12,2023-12,120,true,published,,Science Fiction,,documents; images,,,,1905,1949,,https://www.lib.uidaho.edu/media/digital/small/dodson.jpg,,,,"6x9 inch color drawing, captioned on the verso in Smith's hand: ""For 'The Hashish-Eater'/C.A.S."" with a quote from the story underneath.",https://www.lib.uidaho.edu/digital/dodson/items/dodson0033.html,https://www.lib.uidaho.edu/digital/dodson/assets,https://github.com/uidaholib/documents-digital-collections-template/tree/dodson,
rrrd,River Recreation Research Database,,289 documents pertaining to various Idaho river recreation research projects.,https://www.lib.uidaho.edu/digital/rrrd/,2023-12,2023-12,289,,published,true,Water; Research,,documents; records,Idaho,46.921048,-116.903855,1980,2006,,https://www.lib.uidaho.edu/media/digital/small/rrrd.jpg,,,,,,https://www.lib.uidaho.edu/digital/rrrd/assets,https://github.com/uidaholib/documents-digital-collections-template/tree/rrrd,"rrrd"
higgins,Robert E. Higgins Collection,,"A collection of photographs by Robert E. Higgins, a professor of plant science at the University of Idaho from 1946 to 1999. During his lifetime, Professor Higgins&apos; photographs were accepted in over 70 juried international salons, and he had one-artist exhibitions in Idaho, Washington, and California.",https://www.lib.uidaho.edu/digital/higgins/,2023-12,2023-12,42,,published,true,Idaho,,images,Idaho,46.72756,-117.01412,1946,1999,,https://www.lib.uidaho.edu/media/digital/small/higgins.jpg,,,,Pioneer,https://www.lib.uidaho.edu/digital/higgins/items/higgins13.html,https://www.lib.uidaho.edu/digital/higgins/assets,https://github.com/uidaholib/base-digital-collections-template/tree/higgins,"higgins"
rwhp,Rural Women's History Project,,"Interviews with Idaho women in Latah, Benewah, Clearwater, Nez Perce, and Shoshone counties discussing the history of rural women's roles, the changes over time that have affected their lives, and how they see themselves in light of these changes.",https://www.lib.uidaho.edu/digital/rwhp/,2023-12,2023-12,112,,published,true,Idaho; Oral History; Women; Rural communities,,images; audio; documents,"St. Maries, Idaho;Lewiston, Idaho;Potlatch, Idaho;Kellogg, Idaho;Orofino, Idaho",,,1975,1980,,https://www.lib.uidaho.edu/media/digital/small/rwhp.jpg,,,,Photograph of Myrtle Cressler Warren standing in front of a quilt.,https://objects.lib.uidaho.edu/rwhp/mg68-2-81-myrtle-warren.jpg,https://www.lib.uidaho.edu/digital/rwhp/assets,https://github.com/uidaholib/oral-history-collections-template/tree/rwhp,
sbwhp,Selway-Bitterroot Wilderness History Project,,"This collection represents the digital objects of the Selway-Bitterroot Wilderness History Project, which is an NEH funded exploration into the human aspects of the Selway-Bitterroot Wilderness.",https://sbw.lib.uidaho.edu/,,,312,,published,,Idaho; Water; Forests; Wilderness; Oral History; Selway-Bitterroot Wilderness Region,,documents; images; podcasts,"Lolo Pass, MT; Lolo Hot Springs, MT; Elk Summit, ID; Freeman Peak, ID; Moose Meadows, ID; Shissler Peak Lookout, ID; Shearer Guard Station, ID; Trapper Peak, ID; Paradise Campground, ID;",46.157491,-114.553871,1920,2011,,https://www.lib.uidaho.edu/media/digital/small/sbwhp.jpg,,,,John Day Ranch,,,,"sbw"
sbw,The Selway-Bitterroot Wilderness History Project,,"This digital collection of documents, photographs, and interviews accompanies The Selway-Bitterroot Wilderness History Project.",https://www.lib.uidaho.edu/digital/sbw/,2023-12,2023-12,312,,hidden,true,Idaho; Water; Forests; Wilderness; Oral History; Selway-Bitterroot Wilderness Region,,documents; images; podcasts,"Lolo Pass, MT; Lolo Hot Springs, MT; Elk Summit, ID; Freeman Peak, ID; Moose Meadows, ID; Shissler Peak Lookout, ID; Shearer Guard Station, ID; Trapper Peak, ID; Paradise Campground, ID;",46.157491,-114.553871,1896,2013,,,,,,Selway 1 mile above Dog Creek,https://objects.lib.uidaho.edu/sbw/sbw274.jpg,https://www.lib.uidaho.edu/digital/sbw/assets,https://github.com/uidaholib/base-digital-collections-template/tree/sbw,
borah,Senator William Edgar Borah Scrapbooks,,"William Edgar Borah was a Republican Senator from Idaho. He first became a candidate for the U.S. Senate in 1903, but was defeated by Weldon Heyburn. He was elected in 1907 and served in that body until his death in 1940. In 1924 he became chairman of the Foreign Relations Committee. He also served on the Judiciary Committee. He was often mentioned as a presidential candidate, but not until 1936 did he actually enter any primaries; his defeat at the convention by Alf Landon was not unexpected. This collection consists of scrapbooks containing newspaper clippings, magazine articles, letters, photographs, and recordings of four of his speeches.",https://www.lib.uidaho.edu/digital/borah/,2023-12,2023-12,17,,published,true,Idaho; Politics,,documents; images; newspapers,Idaho,,,1904,1947,,https://www.lib.uidaho.edu/media/digital/small/borah.jpg,,,,,,https://www.lib.uidaho.edu/digital/borah/assets,https://github.com/uidaholib/documents-digital-collections-template/tree/borah,
shitamae,Shitamae Family Letters,,Letters from Minidoka Incarceration Camp during World War II,https://www.lib.uidaho.edu/digital/shitamae/,2023-12,2023-12,132,,published,true,Idaho; War,,documents; images,Idaho,42.67890476495952,-114.25007455136189,1942,1944,,https://www.lib.uidaho.edu/media/digital/small/shitamae.jpg,,,,Letter to Shihei (George) Shitamae,https://www.lib.uidaho.edu/digital/objects/shitamae/mg387_03_129.jpg,https://www.lib.uidaho.edu/digital/shitamae/assets,https://github.com/uidaholib/documents-digital-collections-template/tree/shitamae,
silver-gold,Silver and Gold Book,,"The Silver and Gold Book was created to represent Moscow at the 1893 World's Columbian Exposition. Mrs. J.H. Forney delegated the task of designing a special work of art to then-president Franklin Gault, the university’s first art teacher Annette Bowman, and local jeweler R.M. Crockett.",https://www.lib.uidaho.edu/digital/silver-gold/,2024-04,2024-04,35,,published,true,U of I; Moscow; Campus,,documents; images,"Moscow, ID",46.729399,-117.012629,1895,2023,,https://www.lib.uidaho.edu/media/digital/small/silver-gold.jpg,,,,Silver and Gold Book edge detail,https://www.lib.uidaho.edu/digital/silver-gold/items/silver-gold004.html,https://www.lib.uidaho.edu/digital/silver-gold/assets,https://github.com/uidaholib/base-digital-collections-template/tree/silver-gold,
fisher,Stanton Gilbert Fisher Collection,,"Writings and memorabilia of Stanton Gilbert Fisher, pioneer and Nez Perce War scout, 1840-1915. Most of the documents are Nez Perce War collectibles, such as maps, photographs and accounts of the war and its participants. The rest of the papers are personal materials related to Fisher, including autobiographical materials as well as the correspondence and census records of several of his family members.",https://www.lib.uidaho.edu/digital/fisher/,2023-12,2023-12,50,,published,true,Northwest; Native Americans; War,,documents; images; newspapers,"Central Idaho; Beaverhead National Forest, MT; White Bird Battlefield, ID;",45.742401,-116.310539,1840,1915,,https://www.lib.uidaho.edu/media/digital/small/fisher.jpg,,,,Colonel J. W. Redington,https://www.lib.uidaho.edu/digital/fisher/items/fisher290.html,https://www.lib.uidaho.edu/digital/fisher/assets,https://github.com/uidaholib/base-digital-collections-template/tree/fisher,"fisher"
stonebraker,Stonebraker Photograph Collection,,"A digital collection comprised of 540 historical photographs taken by William Allen Stonebraker at the turn of the century and into the 1920s and 1930s documenting the Salmon River, the Frank Church-River of No Return, the Chamberlain Basin, and the Thunder Mountain Gold Rush.",https://www.lib.uidaho.edu/digital/stonebraker/,2023-12,2023-12,528,,published,true,Mining; Wilderness; Idaho,,images,"Salmon River; Frank Church-River of No Return Wilderness (Idaho); Chamberlain Basin, ID;",44.948193,-115.135872,1900,1931,,https://www.lib.uidaho.edu/media/digital/small/stonebraker.jpg,,,,Men in Submerged Boat,https://www.lib.uidaho.edu/digital/stonebraker/items/stonebraker155.html,https://www.lib.uidaho.edu/digital/stonebraker/assets,https://github.com/uidaholib/base-digital-collections-template/tree/stonebraker,"stonebraker"
taylorranch,Taylor Ranch Log Book Collection,,"The nine log books in this collection detail daily events from 1997 to 2010 recounted by those living and working at the Taylor Wilderness Research Station. In addition to describing the routine research and maintenance task, the logs also provide wildlife sightings and firsthand accounts of harrowing events, such as the dramatic forest fire and evacuation of the year 2000.",https://www.lib.uidaho.edu/digital/taylor/,,,9,,published,,Idaho; Forests; Wilderness,,documents,"Taylor Ranch, ID; Frank Church-River of No Return Wilderness (Idaho)",45.103422,-114.851106,1997,2010,,https://www.lib.uidaho.edu/media/digital/small/taylorranch.jpg,,,,Taylor Log Book,https://www.lib.uidaho.edu/digital/taylor/items/taylor_ranch_05.html,https://www.lib.uidaho.edu/digital/taylor/,https://github.com/uidaholib/taylor_source,"taylor"
t-abraham,Terry Abraham Web Archive,,"The Terry Abraham Web Archive preserves the writing, scholarship, and resources of Terry Abraham that were originally published on University of Idaho's early websites.",https://www.lib.uidaho.edu/special-collections/t-abraham/,,,38,,published,,Idaho; U of I; Research,,,"University of Idaho; Moscow, ID;",46.728014,-117.011009,1990,2005,"files are in main website project, special-collections/t-abraham",https://www.lib.uidaho.edu/media/digital/small/t-abraham.jpg,,,,FOL: A History of the Friends of the Library web archive,,,,
argonaut,The Argonaut Archive,,The Argonaut is the newspaper of the University of Idaho. We hold historical copies from 1898+,https://www.lib.uidaho.edu/digital/argonaut/,2023-12,2023-12,6526,,published,true,Idaho; Campus; U of I; Sports,Campus Collections,documents; newspapers,"University of Idaho; Moscow, ID;",46.728347,-117.007264,1898,2010,extremely customized,https://www.lib.uidaho.edu/media/digital/small/argonaut.jpg,,,,front page of an arg newspaper,https://www.lib.uidaho.edu/digital/argonaut/items/arg-1945-09-19.html,https://www.lib.uidaho.edu/digital/argonaut/assets,https://github.com/uidaholib/campus-collections-template/tree/argonaut,"argonaut"
bigburn,The Big Burn Collection,,"The Big Burn Collection is an online exhibit of materials related to the &apos;Big Burn&apos; fires of 1910 that devastated much of Northern Idaho and Northwest Montana. The collection includes photographs, documents, first-person accounts, and oral histories pertaining to the fires and the local and national responses to them.",https://www.lib.uidaho.edu/digital/bigburn/,2023-12,2023-12,65,,published,true,Idaho; Mining; Fire; Northwest; Forests,Exhibit,images; documents,"Wallace, ID; Lolo Pass, MT; Selway-Bitterroot Wilderness Region",47.487853,-115.872459,1910,1910,,https://www.lib.uidaho.edu/media/digital/small/bigburn.jpg,,,,"Forest Fire - Wallace Idaho Aug 20, 1910 Men burned in the fire",https://objects.lib.uidaho.edu/bigburn/bigburn15.jpg,https://www.lib.uidaho.edu/digital/bigburn/assets,https://github.com/uidaholib/base-digital-collections-template/tree/bigburn,"bigburn"
blot,The Blot Magazine Archive,,University of Idaho's Student Run Magazine,https://www.lib.uidaho.edu/digital/blot/,2023-12,2023-12,85,,published,true,Campus; U of I; Literature,Campus Collections,documents,"University of Idaho; Moscow, ID;",46.728347,-117.007264,1946,2021,,https://www.lib.uidaho.edu/media/digital/small/blot.jpg,,,,"Blot Magazine Welcome Issue Cover, September 1949",https://www.lib.uidaho.edu/digital/blot/items/blot_1949-september.html,https://www.lib.uidaho.edu/digital/blot/assets,https://github.com/uidaholib/documents-digital-collections-template/tree/blot,
forester,The Idaho Forester Collection,,"The Idaho Forester was published annually from 1917 - 1997 by the University of Idaho&apos;s forestry program. The journal combines research articles, UI program activities information, and analysis of the forest products industry, formerly the dominant industry in Northern Idaho. The collection was developed with the support of a Project Ceres Grant from the Center for Research Libraries and the United States Agricultural Information Network.",https://www.lib.uidaho.edu/digital/forester/,2023-12,2023-12,77,,published,true,Forests; Idaho; Northwest; U of I,,documents,"Moscow, ID",46.729399,-117.012629,1917,1997,,https://www.lib.uidaho.edu/media/digital/small/forester.jpg,,,,The Idaho Forester - 1935 (Vol. 17),,https://www.lib.uidaho.edu/digital/forester/assets,https://github.com/uidaholib/campus-collections-template/tree/forester,"forester"
maps,The Map Room,,The Map Room is an interactive Google map application that allows users to browse over 8000 images on a digital map. Use the drop down menus and search box at the top of each map to further refine your browsing.,https://www.lib.uidaho.edu/digital/maps/,,,,,published,,Forests; Fire; Wilderness; Mining; U of I; Idaho; Sports; Maps,Application,maps,United States,46.7274,-117.01388,1860,2014,,https://www.lib.uidaho.edu/media/digital/small/maps.jpg,,,,The Map Room Website,https://www.lib.uidaho.edu/digital/maps/,,,
troosevelt,The Theodore Roosevelt Collection,,A collection of photographs from the University of Idaho Historical Photographs Collection commemorating the 100th anniversary of President&apos;s Roosevelt&apos;s historic visit to the University of Idaho campus in 1911.,https://www.lib.uidaho.edu/digital/troosevelt/,2023-12,2023-12,43,,published,true,U of I; Campus; Politics,Exhibit,images,"University of Idaho (Admin Lawn); Moscow, ID;",46.726209,-117.010521,1911,1911,,https://www.lib.uidaho.edu/media/digital/small/troosevelt.jpg,,,,Roosevelt on platform in front of University of Idaho Administration Building leaning toward Idaho Governor James Hawley,https://www.lib.uidaho.edu/digital/uihistorical/items/spec_uihp401.html,https://www.lib.uidaho.edu/digital/troosevelt/assets,https://github.com/uidaholib/base-digital-collections-template/tree/troosevelt,
treesgrewtall,The Trees Grew Tall Photograph Collection,,"A digital collection comprised of 242 photographs of life in Bovill, Idaho and surrounding areas from 1898 - 1943. These photographs were taken or collected by Bovill native and author John B. Miller.",https://www.lib.uidaho.edu/digital/treesgrewtall/,2023-12,2023-12,242,,published,true,Idaho; Forests,,images,"Bovill, ID",46.85842341,-116.3939099,1898,1943,,https://www.lib.uidaho.edu/media/digital/small/treesgrewtall.jpg,,,,"River near Bovill, Idaho",https://objects.lib.uidaho.edu/treesgrewtall/trees200.jpg,https://www.lib.uidaho.edu/digital/treesgrewtall/assets,https://github.com/uidaholib/base-digital-collections-template/tree/treesgrewtall,"treesgrewtall"
etd,Theses and Dissertation Collection,,"An open access repository of theses and dissertations (ETD) from University of Idaho graduate students. The collection includes complete electronic theses and dissertations submitted since approximately 2014, as well as digitized copies of earlier documents going back to 1910.",https://www.lib.uidaho.edu/digital/etd/,2023-12,2023-12,1855,,published,,U of I; Research,,documents,"University of Idaho (Library); Moscow, ID;",46.73524,-117.01396,1909,2011,cb not standard,https://www.lib.uidaho.edu/media/digital/small/etds.jpg,,,,Students studying at desks in the library,https://www.lib.uidaho.edu/digital/campus/items/campus00806.html,https://www.lib.uidaho.edu/digital/etd/assets,https://github.com/uidaholib/documents-digital-collections-template/tree/etd,"etd"
transitions,Transitions Journal,,"The Transitions Journal Digital Collection is a digital repository for Transitions, a conservation-focused publication edited and published by John Osborn from 1988 to 2000.",https://www.lib.uidaho.edu/digital/transitions/,2024-02,2024-02,80,,published,true,Environmental; Water; Forests; Wilderness; Mining,,documents,Pacific Northwest,47.657495,-117.416277,1988,2000,,https://www.lib.uidaho.edu/media/digital/small/transitions.jpg,,,,Smokey bear on transitions journal cover,https://www.lib.uidaho.edu/digital/transitions/items/transitions45.html,https://www.lib.uidaho.edu/digital/transitions/assets,https://github.com/uidaholib/documents-digital-collections-template/tree/transitions,"transitions"
turning,Turning of the Wheel Collection - Humanities Colloquium 2011-2012,,"A Digital Collection of Events from the Humanities Colloquium Series, Turning of the Wheel, University of Idaho | Moscow, Idaho | 2011-2012",https://www.lib.uidaho.edu/digital/turning/,,,491,,published,,U of I; Campus; Research,,documents; images; videos,"University of Idaho (Commons); Moscow, ID;",46.727391,-117.013046,2011,2012,early custom project,https://www.lib.uidaho.edu/media/digital/small/turning.jpg,,,,Ad for the collection,,,,"turning"
turningwheel,Turning of the Wheel,,"A Digital Collection of Events from the Humanities Colloquium Series, Turning of the Wheel, University of Idaho | Moscow, Idaho | 2011-2012",https://www.lib.uidaho.edu/digital/turningwheel/,2023-12,2023-12,490,,hidden,,U of I; Campus; Research,,documents; images; videos,"University of Idaho (Commons); Moscow, ID;",46.727391,-117.013046,2011,2012,,,,,,,,https://www.lib.uidaho.edu/digital/turningwheel/assets,https://github.com/uidaholib/base-digital-collections-template/tree/turningwheel,
campus,UI Campus Photograph Collection,,The University of Idaho Campus Photograph Collection contains over 3000 historical photographs of the UI Campus from 1889 to the present.,https://www.lib.uidaho.edu/digital/campus/,2023-12,2023-12,3119,,published,true,Campus; U of I,Campus Collections,images,"University of Idaho; Moscow, ID;",46.728014,-117.011009,1889,2014,,https://www.lib.uidaho.edu/media/digital/small/campus.jpg,,,,"Administration Building, University of Idaho from southeast. [52-4]",https://www.lib.uidaho.edu/digital/campus/items/campus02245.html,https://www.lib.uidaho.edu/digital/campus/assets,https://github.com/uidaholib/campus-collections-template/tree/campus,"pg1"
uief,UIEF Research Exchange,,The University of Idaho Experimental Forest (UIEF) is Idaho's primary working research and teaching forest. The Research Exchange is a living database that provides access to UIEF research and related content to help inspire scientific inquiry and inform forestry and natural resource management.,https://www.lib.uidaho.edu/digital/uief/,2024-02,2024-02,287,,published,true,Campus; U of I; Research; Forests,,documents,UIEF,46.836471,-116.802608,1928,2022,"customized, external workflow for adding new items",https://www.lib.uidaho.edu/media/digital/small/uief.jpg,,,,U of I Experimental Forest,,https://www.lib.uidaho.edu/digital/uief/assets,https://github.com/uidaholib/documents-digital-collections-template/tree/uief,
commencement,University of Idaho Commencement Programs,,A digital collection comprised of 169 University of Idaho commencement programs and other pamphlets spanning the years 1896-2019.,https://www.lib.uidaho.edu/digital/commencement/,2023-12,2023-12,169,,published,true,Campus; U of I,Campus Collections,documents,"University of Idaho; Moscow, ID;",46.728014,-117.011009,1896,2019,,https://www.lib.uidaho.edu/media/digital/small/commencement.jpg,,,,Black and white image of students during graduation.,,https://www.lib.uidaho.edu/digital/commencement/assets,https://github.com/uidaholib/campus-collections-template/tree/commencement,"commencement"
