objectid,title,tagline,description,url,last_update,created,item_count,featured,status,search_index,categories,type,media_types,location,latitude,longitude,date_start,date_end,notes,old_image,featured_image,image_small,image_thumb,image_alt_text,image_source,data_location,repository_location,cdmid
idahosnow,Idaho Snow Loads,,"This resources relates to the report &apos;Ground and Roof Snow Loads for Idaho,&apos; which was released in 1986 by the Department of Civil Engineering at the University of Idaho. To read the report and it&apos;s appendices, click on the cover. To use the map, click on the map. This map has been made possible by several years of nonfunded work. We respectfully request that if you use this map or report for commercial purposes, you purchase a pdf/map (information at top right) or donate to the University of Idaho Library.",https://www.lib.uidaho.edu/digital/idahosnow/,,,,,published,,Idaho; Construction,Application,documents,Idaho,43.492285,-114.411621,1986,1987,,https://www.lib.uidaho.edu/media/digital/small/idahosnow.jpg,,,,Idaho Snow Load Map,https://www.lib.uidaho.edu/digital/idahosnow/elevation.html,,https://github.com/uidaholib/idahosnow_source,
tpa,Idaho Timber Protective Association Reports,,"Annual reports published by Idaho Timber Protective Associations, including the Coeur D'Alene Timber Protective Association, the Pend d'Oreille Timber Protective Association, the Potlatch Timber Protective Association, and the Priest Lake Timber Protective Association.",https://www.lib.uidaho.edu/digital/tpa/,2023-12,2023-12,42,,published,true,Idaho; Forests,,documents,Idaho,,,1910,1964,,https://www.lib.uidaho.edu/media/digital/small/tpa.jpg,,,,Cover of combined Annual Reports Potlatch Timber Protective Association 1961-1962. Features a forest fire illustration,,https://www.lib.uidaho.edu/digital/tpa/assets,https://github.com/uidaholib/documents-digital-collections-template/tree/tpa,
iwdl,Idaho Waters Digital Library,,"The Idaho Waters Digital Library provides access to information resources relating to water issues in key Idaho river basins. The collection presently includes scientific and technical reports, with an emphasis on [Idaho Water Resources Research Institute](https://www.uidaho.edu/research/iwrri) reports and publications. Documents can be browsed by [Location](map.html 'Browse by Map'), [Date](timeline.html 'Browse by Time'), and [Subject Term](subjects.html 'Browse by Subject') by using the tabs above. The database can also be queried extensively using the [Table](table.html 'Browse/Search by Table') feature. This project would not have been possible without the grant support of the [United States Geological Survey](https://www.uidaho.edu/research/iwrri/aboutiwrri), the administrative support of the [Idaho Water Resources Research Institute](https://www.uidaho.edu/research/iwrri/aboutiwrri), the metadata &amp; digitization work of Warren Bromley-Vogel, and the conceptual efforts of Jodi Haire.",https://www.lib.uidaho.edu/digital/iwdl/,2020-10,2020-10,476,,published,true,Idaho; Water; Wilderness; Mining; Research,,documents,"Idaho; Coeur D'Alene, ID; Lewiston, ID; Boise, ID;",43.608655,-116.193734,1963,1984,cb not standard,https://www.lib.uidaho.edu/media/digital/small/iwdl.jpg,,,,Research in water resources for Idaho,,https://www.lib.uidaho.edu/digital/iwdl/assets,https://github.com/uidaholib/documents-digital-collections-template/tree/iwdl,"idahowater"
iwi,Idaho's Women of Influence,,A database of important women in the history of the state of Idaho,https://www.lib.uidaho.edu/digital/iwi/,2023-12,2023-12,30,,published,,Idaho; Women,,documents; images,Idaho,,,,,,https://www.lib.uidaho.edu/media/digital/small/iwi.jpg,,,,Black and white historical photo of women,https://www.lib.uidaho.edu/digital/objects/iwi/c04.jpg,https://www.lib.uidaho.edu/digital/iwi/assets,https://github.com/uidaholib/base-digital-collections-template/tree/iwi,
inside,INSIDE Idaho,,"INSIDE Idaho is the official geospatial data clearinghouse for the State of Idaho. INSIDE Idaho serves as a comprehensive geospatial data digital library, providing access to, and a context within which to use, geospatial data and information by, for, and about Idaho.",https://www.insideidaho.org/,,,,,published,,U of I; Research; Maps; Environmental,,images; data,Idaho,,,1998,,,https://www.lib.uidaho.edu/media/digital/small/insideidaho.jpg,,,,,,,https://github.com/uidaholib/inside_source,
ir,University of Idaho Institutional Repository Collection,,Research articles and other documents produced by individuals and entities from the University of Idaho.,https://www.lib.uidaho.edu/digital/ir/,2023-12,2023-12,143,,published,true,Research,,documents; records,"University of Idaho; Moscow, ID;",46.727309,-117.012272,1955,2021,,https://www.lib.uidaho.edu/media/digital/small/ir.jpg,,,,na,na,https://www.lib.uidaho.edu/digital/ir/assets,https://github.com/uidaholib/documents-digital-collections-template/tree/ir,"IR"
iftnc,Intermountain Forestry Cooperative,,"A collection of reports, studies, and documents published by the Intermountain Forest Tree Nutrition Cooperative (IFTNC), a research cooperative composed of public and private forestry organizations that is located administratively in the College of Natural Resources at the University of Idaho.",https://www.lib.uidaho.edu/digital/iftnc/,2023-12,2023-12,39,,published,true,Forests; Northwest; Research,,documents,Inland Northwest,46.729312,-117.012924,1984,1991,,https://www.lib.uidaho.edu/media/digital/small/iftnc.jpg,,,,Trees in the mountains,https://upload.wikimedia.org/wikipedia/commons/e/ed/Ponderosas%2C_Sisters%2C_OR_8-13a_%2814668429091%29.jpg,https://www.lib.uidaho.edu/digital/iftnc/assets,https://github.com/uidaholib/documents-digital-collections-template/tree/iftnc,"iftnc"
ijc,International Jazz Collections (IJC),,"The International Jazz Collections (IJC) was formally established at the University of Idaho in 2000, featuring papers and photographs of the legendary Lionel Hampton. The IJC merged with the University of Idaho Library's Special Collections & Archives department in 2007. It is now the preeminent jazz archive in the Pacific Northwest.",https://www.ijc.uidaho.edu/,2023-12,2023-12,0,,published,,IJC; Jazz; U of I,International Jazz Collections,,"University of Idaho (Library); Moscow, ID;",46.72732,-117.01588,1900,2002,,https://www.lib.uidaho.edu/media/digital/small/ijc.jpg,,,,Collage International Jazz Collection Image,https://www.ijc.uidaho.edu/,,https://github.com/uidaholib/ijc-collection-template/tree/ijc_home,"ijc"
williams_joe,Joe Williams Collection,,"Joe Williams was a vocalist who began singing professionally in the late 1930's. He worked with the big bands of Coleman Hawkins, Lionel Hampton and Count Basie; it was with Basie that Williams had his first recording hits. Williams won many awards and professional recognition. In the 1980's he had a recurring role (as 'Grandpa Al') on TV's The Cosby Show. He died in Las Vegas on March 29, 1999.",https://www.ijc.uidaho.edu/williams_joe/,2023-12,2023-12,147,,published,true,IJC; Jazz,International Jazz Collections,scores,"University of Idaho (Library); Moscow, ID;",46.72732,-117.01488,1930,1970,,https://www.lib.uidaho.edu/media/digital/small/williams_joe.jpg,,,,Score for They Can&apos;t Take That Away from Me,https://objects.lib.uidaho.edu/ijc/joe_williams/ijc_jw_002.jpg,https://www.ijc.uidaho.edu/williams_joe/assets,https://github.com/uidaholib/ijc-collection-template/tree/williams_joe,"ijcw"
kooskia,Kooskia Internment Camp Scrapbook,,"The Kooskia Internment Camp Scrapbook documents the sights, tasks, scenes, and events of Japanese men detained during the camp&apos;s two years or operation (May 1943 - May 1945). The camp was located in a remote area of north central Idaho, 30 miles from the town of Kooskia; it was administered by the U.S. Immigration and Naturalization Service (INS) for the U.S. Department of Justice.",https://www.lib.uidaho.edu/digital/Kooskia/,2022-04,2022-04,387,true,published,true,Idaho; War,,scrapbook; images,"Kooskia, ID",46.144012,-115.594819,1943,1945,,https://www.lib.uidaho.edu/media/digital/small/kooskia.jpg,,,,Kooskia Internment Camp Scrapbook Entrance Sign,,https://www.lib.uidaho.edu/digital/kooskia/assets,https://github.com/uidaholib/base-digital-collections-template/tree/kooskia,"spec_kic"
laughlin,Kyle Laughlin Photographs,,"The images of the Kyle Laughlin Photograph Collection, taken from 1931 to 1979, depict Idaho&apos;s natural scenery and historic sites, as well as personal moments from Kyle Laughlin&apos;s life. Laughlin was a Moscow, Idaho resident and businessman for 56 years; he owned several businesses, including a photo shop, an appliance store, and a television/cable company.",https://www.lib.uidaho.edu/digital/Laughlin/,2023-12,2023-12,828,,published,true,Idaho; Water; Agriculture; U of I; Latah County,,images,"Idaho; Washington; Montgomery, AL; Acoma Village, NM; Topeka, KS; St. Louis, MO; Denver, CO; Cheyenne, WY; Little Bighorn Battlefield, MT; Vaseux Lake, B.C.",46.706833,-116.92294,1935,1937,,https://www.lib.uidaho.edu/media/digital/small/laughlin.jpg,,,,"Fishing Contest, 1937",https://www.lib.uidaho.edu/digital/laughlin/items/spec_kl955.html,https://www.lib.uidaho.edu/digital/laughlin/assets,https://github.com/uidaholib/base-digital-collections-template/tree/laughlin,"spec_kl"
lcheritage,Latah County Community Heritage Collection,,The Latah County Common Heritage Collection was driven by funding from a National Endowment for the Humanities (NEH) Common Heritage Grant awarded to the University of Idaho Library in 2016. The materials in this collection were collected via community digitization days held in Moscow and Potlatch in 2016 and 2017.,https://www.lib.uidaho.edu/digital/lcheritage/,2024-02,2024-02,733,,published,true,"Idaho; Northwest; Forests; Wilderness; Fire; Latah County; Moscow; Potlatch, ID",,documents; images,"University of Idaho (Library); Moscow, ID;",46.738036,-116.67842,1880,2016,,https://www.lib.uidaho.edu/media/digital/small/lcheritage.jpg,,,,Kelvin Daniels in front of fire,https://www.lib.uidaho.edu/digital/lcheritage/items/lcheritage7.html,https://www.lib.uidaho.edu/digital/lcheritage/assets,https://github.com/uidaholib/base-digital-collections-template/tree/lcheritage,"lcheritage"
latahsites,Latah County Historic Places,,"This collaborative project, between the Latah Preservation Commission (LPC) and the University of Idaho Library, illustrates the Latah County Historic Touring Map that has been in print for many years.",https://www.lib.uidaho.edu/digital/latahsites/,2024-05,2024-05,90,,published,true,Idaho; Latah County; Northwest,,images,"Moscow, ID",46.72929,-117.012801,1889,2024,,https://www.lib.uidaho.edu/media/digital/small/latah_historic.jpg,,,,McConnell Mansion,https://www.lib.uidaho.edu/digital/latahsites/items/latahsites0070.html,https://www.lib.uidaho.edu/digital/latahsites/assets,https://github.com/uidaholib/base-digital-collections-template/tree/latahsites,
lcoh,Latah County Oral Histories,,"In the mid 1970s, the Latah County Historical Society collected over 300 oral histories from local Northern Idaho residents who grew up in Idaho during the early part of the 20th century. The Latah County Oral History Project produced one of the largest collections of oral histories in the Pacific Northwest. A copy of the transcripts and cassette recordings was donated to the University of Idaho Library in 1987. Those items were digitized and uploaded into our database in 2013.",https://www.lib.uidaho.edu/digital/lcoh/,2023-12,2023-12,330,true,published,true,"Idaho; Northwest; Forests; Wilderness; Fire; Latah County; Moscow; Potlatch, ID; Oral History",,documents; audio,"University of Idaho (Library); Moscow, ID;",46.736036,-116.67642,1970,1979,highly customized,https://www.lib.uidaho.edu/media/digital/small/lcoh.jpg,,,,Carol Ryrie Brink,https://www.lib.uidaho.edu/digital/lcoh/people/BRINK_Carol.html,https://www.lib.uidaho.edu/digital/lcoh/assets,https://github.com/uidaholib/oral-history-collections-template/tree/lcoh,"latah"
morse_lee,Lee Morse Collection,,Lee Morse was an American singer and songwriter. The collection includes mainly photographs and sound recordings.,https://www.ijc.uidaho.edu/morse_lee/,2023-12,2023-12,105,,published,true,IJC; Jazz,International Jazz Collections,images,"University of Idaho (Library); Moscow, ID;",46.72732,-117.01388,1924,1941,,https://www.lib.uidaho.edu/media/digital/small/morse_lee.jpg,,,,Lee Morse playing guitar,https://objects.lib.uidaho.edu/ijc/morse_lee/ijc_lee_morse_008.jpg,https://www.ijc.uidaho.edu/morse_lee/assets,https://github.com/uidaholib/ijc-collection-template/tree/morse_lee,"ijclm"
ames,Leo Ames Papers,,"A collection of materials including poster designs, working drafts, correspondence, and office files from Leo Ames's time as the University of Idaho's creative director and head of publications.",https://www.lib.uidaho.edu/digital/ames/,2023-12,2023-12,38,,published,true,U of I; Art,,images; documents,"University of Idaho (Library); Moscow, ID;",46.72732,-117.01388,1968,1989,csv,https://www.lib.uidaho.edu/media/digital/small/ames.jpg,,,,,,https://www.lib.uidaho.edu/digital/ames/assets,https://github.com/uidaholib/base-digital-collections-template/tree/ames,
blindfold,Leonard Feather Blindfold Tests,,The Blindfold Tests are a series of interviews conducted by jazz critic Leonard Feather with prominent jazz musicians throughout the 20th century.,https://www.lib.uidaho.edu/digital/blindfold/,2020-09,2020-09,23,,published,,IJC; Jazz,International Jazz Collections,audio,,,,1951,1987,ijc,https://www.lib.uidaho.edu/media/digital/small/blindfold.jpg,,,,"Nat Adderley and Julian ""Cannonball"" Adderley",,https://www.lib.uidaho.edu/digital/blindfold/,https://github.com/uidaholib/blindfold_draft,
feather_leonard,Leonard Feather Jazz Collection,,"The Leonard Feather Collection includes a variety of materials that document and describe the Jazz scene during the middle of the twentieth century. Feather was born in London in 1914 and moved to New York City in 1939. He was a journalist, producer, composer and jazz critic. The collection contains- photos, notebooks, sketches, scores, correspondence, clippings, manuscripts, notes and financial papers.",https://www.ijc.uidaho.edu/feather_leonard/,2023-12,2023-12,5672,,published,true,IJC; Jazz,International Jazz Collections,images; documents; audio; illustrations; scores; videos,"University of Idaho (Library); Moscow, ID;",46.72748,-117.01404,1900,1999,,https://www.lib.uidaho.edu/media/digital/small/feather_leonard.jpg,,,,Leonard Feather and Maragaret Sands at the Savoy Ballroom,https://objects.lib.uidaho.edu/ijc/feather_leonard/ijc_leonard_feather_161.jpg,https://www.ijc.uidaho.edu/feather_leonard/assets,https://github.com/uidaholib/ijc-collection-template/tree/feather_leonard,"lfc"
lewistonorch,Lewiston Orchards Life Newsletter,,"Lewiston Orchards Life was a newsletter published in Lewiston, Idaho during the early 1900s. The newsletter covers the residential and horticultural lives of those living in the Lewiston Orchards area, which is now a residential neighborhood.",https://www.lib.uidaho.edu/digital/LewistonOrch/,2023-12,2023-12,25,,published,true,Idaho; Agriculture,,documents,"Lewiston, ID",46.38071,-116.974847,1913,1914,,https://www.lib.uidaho.edu/media/digital/small/lewistonorch.jpg,,,,"Lewiston Orchards Life, 1914 April",https://www.lib.uidaho.edu/digital/lewistonorch/items/spec_lof230.html,https://www.lib.uidaho.edu/digital/lewistonorch/assets,https://github.com/uidaholib/documents-digital-collections-template/tree/lewistonorch,"spec_lof"
jazzfest,Lionel Hampton Jazz Festival Collection,,"A digital collection comprised of 30 years' worth of posters, programs, photographs, and oral histories related to the Lionel Hampton Jazz Festival at the University of Idaho.",https://www.lib.uidaho.edu/digital/jazzfest/,2023-12,2023-12,176,,published,true,IJC; Jazz; U of I,International Jazz Collections,documents; images; videos,"University of Idaho; Moscow, ID;",46.72732,-117.01388,1969,2020,ijc,https://www.lib.uidaho.edu/media/digital/small/jazzfest.jpg,,,,Lionel Hampton,https://objects.lib.uidaho.edu/jazzfest/jazzfest65.jpg,https://www.lib.uidaho.edu/digital/jazzfest/assets,https://github.com/uidaholib/ijc-collection-template/tree/jazzfest,"jazzfest"
hampton_collection,Lionel Hampton Library Collection,,"The materials in the Lionel Hampton collection span most of his musical career, 1926–2002, with the bulk of the collection dating 1940–1990. The digital collection includes photographs, arrangements, and images of awards and ephemera.",https://www.ijc.uidaho.edu/hampton_collection/,2023-12,2023-12,6660,,published,true,IJC; Jazz,International Jazz Collections,documents; images; scores,"University of Idaho (Library); Moscow, ID;",46.72748,-117.01412,1918,2002,,https://www.lib.uidaho.edu/media/digital/small/hampton_collection.jpg,,,,Lionel Hampton&apos;s Birthday Party,https://objects.lib.uidaho.edu/ijc/hampton_collection/ijc_lionel_hampton_2971.jpg,https://www.ijc.uidaho.edu/hampton_collection/assets,https://github.com/uidaholib/ijc-collection-template/tree/hampton_collection,"ijcs"
mainstreet,Main Street Video,,"An oral-historical exploration of the last video store in Moscow, Idaho, featuring interviews with former staff, customers, board members, and owners of the Main Street Video Co-Op and Howard Hughes Video.Collection Essays by Milo Muise. Interviews conducted by: Monique Lillard and Beau Newsome.",https://www.lib.uidaho.edu/digital/mainstreet/,2024-04,2024-04,34,,published,,Oral History; Moscow,CDIL,essays; videos,"Moscow, ID",46.732062,-116.998138,2021,2021,,https://www.lib.uidaho.edu/media/digital/small/mainstreet.jpg,,,,Main Street Video,https://www.lib.uidaho.edu/digital/mainstreet/assets/img/tvimage.png,https://www.lib.uidaho.edu/digital/mainstreet/assets,https://github.com/uidaholib/mainstreetvideo_source,
calnon,Mark Brooks Calnon Collection,,"The Mark Brooks Calnon Collection consists of estate materials from 2nd. Lt. Mark Brooks Calnon, including memorabilia relating to his experiences in World War II as a pilot and prisoner of war. The collection includes photographs, documents, an oral history (audio/video/transcript), and a copy of Calnon&apos;s book, Some Lived, Some Died It Was Understood. The collection was put together by Journalism and Mass Media Professor Denise Bennett as part of a Seed Grant funded project.",https://www.lib.uidaho.edu/digital/calnon/,2023-12,2023-12,53,true,published,,Idaho; Labor; War,,documents; images; audio; videos,"Boise, ID; Germany",43.61349,-116.227996,1941,2013,,https://www.lib.uidaho.edu/media/digital/small/calnon.jpg,,,,B17 Crew Portrait,https://www.lib.uidaho.edu/digital/calnon/items/calnon15.html,https://www.lib.uidaho.edu/digital/calnon/assets,https://github.com/uidaholib/base-digital-collections-template/tree/calnon,"calnon"
mccall,McCall Public Library Collection,,A collection of family history-related items form the McCall Public Library,https://www.lib.uidaho.edu/digital/mccall/,2022-05,2022-05,319,,published,,Idaho; Water; Wilderness,,documents; images,"McCall, ID",44.908901,-116.099141,1815,2014,,https://www.lib.uidaho.edu/media/digital/small/mccall.jpg,,,,McCall Library,https://mccall.lili.org/,https://www.lib.uidaho.edu/digital/mccall/assets,https://github.com/uidaholib/base-digital-collections-template/tree/mccall,"mccall"
mcclure,McClure Center Archive,,A collection of publications from the University of Idaho's James A. and Louise McClure Center for Public Policy Research,https://www.lib.uidaho.edu/digital/mcclure/,2023-12,2023-12,85,,published,true,Idaho; U of I; Research,,documents,Idaho,,,2003,2022,,https://www.lib.uidaho.edu/media/digital/small/mcclure.jpg,,,,Water Snapshot: Idaho Climate-Economy Impacts Assessment,,https://www.lib.uidaho.edu/digital/mcclure/assets,https://github.com/uidaholib/documents-digital-collections-template/tree/mcclure,
moscon,MosCon Collection,,"MosCon was a vibrant regional science fiction convention based in Moscow, Idaho, organized by the Palouse Empire Science Fiction Association (PESFA). This digital collection provides access to MosCon program booklets and related artifacts for the twenty-two annual conventions held from 1979 to 2001.",https://www.lib.uidaho.edu/digital/moscon/,2024-02,2024-02,34,true,published,true,Science Fiction; Moscow,,documents; images,"Moscow, ID",46.732062,-116.998138,1978,2019,some customized,https://www.lib.uidaho.edu/media/digital/small/moscon.jpg,,,,,,https://www.lib.uidaho.edu/digital/moscon/assets,https://github.com/uidaholib/documents-digital-collections-template/tree/moscon,
moscowcoop,Moscow Food Co-op Collection,,"Digitized newsletters published by the Moscow Food Co-op, a cooperatively-owned grocery store in Moscow, Idaho. Newsletter content includes announcements and descriptions of community events, articles on food and gardening, and recipes.",https://www.lib.uidaho.edu/digital/moscowcoop/,2023-12,2023-12,338,,published,true,Moscow; Grocery; Food,,documents,"Moscow, ID",46.732062,-116.998138,1975,2016,,https://www.lib.uidaho.edu/media/digital/small/moscowcoop.jpg,,,,Cover of newsletter September 1987 featuring corn on the cob on a yellow background,https://www.lib.uidaho.edu/digital/moscowcoop/items/moscowcoop0015.html,https://www.lib.uidaho.edu/digital/moscowcoop/assets,https://github.com/uidaholib/documents-digital-collections-template/tree/moscowcoop,"moscowcoop"
hiroshima,Moving Forward While Looking Back,,"This exhibit explores the impact that World War II had not only on those of Japanese ancestry in the United States, but also those in Japan who survived and rebuilt after the use of the atomic bomb and the role Idaho played through it all. It looks at the atrocities of war and the resilience and hope of those who live through it.",https://www.lib.uidaho.edu/digital/hiroshima/,2023-12,2023-12,83,,published,true,U of I; Japan; War,,images; documents,"Hiroshima, Japan",34.37638234,132.4695732,1941,2011,,https://www.lib.uidaho.edu/media/digital/small/hiroshima.jpg,,,,Hiroshima or Nagasaki after bombing,https://www.lib.uidaho.edu/digital/hiroshima/items/hiroshima001.html,https://www.lib.uidaho.edu/digital/hiroshima/assets,https://github.com/uidaholib/base-digital-collections-template/tree/hiroshima,
fiddlers,National Oldtime Fiddlers' Collection,,"A collection of recordings and memorabilia from the National Oldtime Fiddlers' Contest and Festival held in Weiser, Idaho.",https://www.lib.uidaho.edu/digital/fiddlers/,2023-12,2023-12,116,,published,true,Idaho; Music,,images; documents; audio,"Weiser, ID",44.25081825,-116.9695324,1953,2023,,https://www.lib.uidaho.edu/media/digital/small/fiddlers.jpg,,,,Signal-American fiddle Edition article,https://www.lib.uidaho.edu/digital/fiddlers/items/fiddlers105.html,https://www.lib.uidaho.edu/digital/fiddlers/assets,https://github.com/uidaholib/base-digital-collections-template/tree/fiddlers,
postcards,Northwest Historical Postcards Collection,,This digital collection of over 800 postcards comes from the historical photograph collections of the University of Idaho Library&apos;s Special Collections &amp; Archives. The postcards range in date from the 1890s to the 1980s.,https://www.lib.uidaho.edu/digital/postcards/,2024-02,2024-02,811,true,published,true,Idaho; Northwest; Forests; Water; Wilderness,,images,Washington; Oregon; Idaho; Montana; Wyoming; British Columbia; Alberta,46.716798,-119.597168,1890,1980,,https://www.lib.uidaho.edu/media/digital/small/postcards.jpg,,,,"Syinga Time, Lake Pend Oreille, North Idaho",https://www.lib.uidaho.edu/digital/postcards/items/nwpostcards406.html,https://www.lib.uidaho.edu/digital/postcards/assets,https://github.com/uidaholib/base-digital-collections-template/tree/postcards,"nwpostcards"
otherfaces,"Other Faces, Other Lives",,"A collection of materials related to the oral history project produced from 1987-90 interviewing Asian American families about their experiences living, working, and raising a family in Idaho.",https://www.lib.uidaho.edu/digital/otherfaces,2024-01,2024-01,34,,published,true,Idaho; Asian Americans; Oral History,,documents; videos,Idaho,43.61414462,-116.2043794,1987,1990,,https://www.lib.uidaho.edu/media/digital/small/otherfaces.jpg,,,,"Screenshots from the Other Faces, Other Lives video.",https://www.lib.uidaho.edu/digital/otherfaces/items/otherfaces075.html,https://www.lib.uidaho.edu/digital/otherfaces/assets,https://github.com/uidaholib/oral-history-collections-template/tree/otherfaces,
ott,Ott Historical Photograph Collection,,"Clifford M. Ott donated this broad collection of historical photographs in 1992. Ott was an avid amateur photographer who amassed over 10,000 slides, prints, and negatives spanning the years from 1883 to 1990. The digital collection represents a selection from Ott&apos;s whole collection, which he compiled into eleven albums containing a total of over 1,800 images of Moscow and surrounding Latah County and used to educate local citizens.",https://www.lib.uidaho.edu/digital/ott/,2024-02,2024-02,1826,,published,true,Idaho; Latah County; Moscow,,images; newspapers,"Latah County, ID; Moscow, ID; Genesee, ID; Potlatch, ID; Princeton, ID; Harvard, ID; Lewiston, ID; Clarkston, WA; Troy, MT; Livingston, MT; Ralston, NE;",46.731518,-117.001358,1880,1989,,https://www.lib.uidaho.edu/media/digital/small/ott.jpg,,,,"Fat Men&apos;s Race. Moscow, July 4, 1911.",https://objects.lib.uidaho.edu/ott/ott0.jpg,https://www.lib.uidaho.edu/digital/ott/assets,https://github.com/uidaholib/base-digital-collections-template/tree/ott,"ott"
