objectid,title,tagline,description,url,last_update,created,item_count,featured,status,search_index,categories,type,media_types,location,latitude,longitude,date_start,date_end,notes,old_image,featured_image,image_small,image_thumb,image_alt_text,image_source,data_location,repository_location,cdmid
1918flu,1918 Flu Pandemic Collection,"Materials depicting the impact of the ""Spanish Flu"" on the University of Idaho","The 1918 Flu Pandemic Collection brings together correspondence, reports, news articles, oral histories, and other materials that highlight the local response to the 1918 pandemic.",https://www.lib.uidaho.edu/digital/1918flu/,2023-12,2023-12,73,,published,true,Idaho; Disease,,documents; images,University of Idaho,46.722532,-117.014779,1910,1975,,,https://objects.lib.uidaho.edu/1918flu/ug12_418_1.jpg,https://objects.lib.uidaho.edu/1918flu/small/ug12_418_1_sm.jpg,https://objects.lib.uidaho.edu/1918flu/thumbs/ug12_418_1_th.jpg,"The first page of a signed petition from the students of the University of Idaho requesting cancellation of studies, school functions, and other duties until after the Thanksgiving Holiday due to the quarantine.",https://www.lib.uidaho.edu/digital/1918flu/items/spanishflu008.html,https://www.lib.uidaho.edu/digital/1918flu/assets,https://github.com/uidaholib/base-digital-collections-template/tree/1918flu,
ferl,Adult Salmon and Steelhead Migration Studies: 1996-2014,,"The University of Idaho's Fish Ecology Research Lab in collaboration with the U.S. Army Corps of Engineers, NOAA-Fisheries, and other research partners has used radiotelemetry to study the migrations, dam passage behaviors, and survival of adult salmon and steelhead in the Columbia River basin since the 1990s, amassing one of the world's largest fish migration datasets along with an extensive catalog of technical reports and peer-reviewed publications.",https://www.lib.uidaho.edu/digital/ferl/,2024-02,2024-02,156,,published,true,Water; Northwest; Research,,documents; data,Columbia River Basin,46,-116,1996,2019,,,https://objects.lib.uidaho.edu/media/ferl-river.jpg,https://objects.lib.uidaho.edu/media/thumbs/ferl-river_th.jpg,https://objects.lib.uidaho.edu/media/small/ferl-river_sm.jpg,photograph of a wild river with forest and mountains,,https://www.lib.uidaho.edu/digital/ferl/assets,https://github.com/uidaholib/documents-digital-collections-template/tree/ferl,
aers,Agricultural Economics Research Series,,A series of documents focused on agricultural economics produced by University of Idaho researchers.,https://www.lib.uidaho.edu/digital/aers/,2023-12,2023-12,401,,published,true,Research; Agriculture; Environmental,,documents,"University of Idaho; Moscow, ID;",46.728347,-117.007264,1956,2006,,,https://objects.lib.uidaho.edu/media/windmills.jpg,https://objects.lib.uidaho.edu/media/thumbs/windmills_th.jpg,https://objects.lib.uidaho.edu/media/small/windmills_sm.jpg,Windmills over wheat fields,,https://www.lib.uidaho.edu/digital/aers/assets,https://github.com/uidaholib/documents-digital-collections-template/tree/aers,"agecon"
uiext,Agricultural Experiment & UI Extension Publications,,"A collaboration between the Library and University of Idaho Extension, the University of Idaho Extension and Idaho Agricultural Experiment Station Publications collection features over 2000 publications that serve as the primary source for practical, research-based information on Idaho agriculture, forestry, gardening, and family and consumer sciences.",https://www.lib.uidaho.edu/digital/uiext/,2023-12,2023-12,3462,,published,true,Research; Agriculture; Environmental,,documents,"Idaho; Moscow, ID (Extension Offices)",46.728077,-117.020026,1892,2011,,,https://objects.lib.uidaho.edu/media/uiext_banner.png,https://objects.lib.uidaho.edu/media/thumbs/uiext_banner_th.jpg,https://objects.lib.uidaho.edu/media/small/uiext_banner_sm.jpg,cover of a pamphlet showing a tractor on wheat,,https://www.lib.uidaho.edu/digital/uiext/assets,https://github.com/uidaholib/documents-digital-collections-template/tree/uiext,"ui_ep"
grey_al,Al Grey and Rosalie Soladar Memorial Collection,,Al Grey was a jazz trombonist and bandleader. Rosalie Soladar was his companion and personal manager. Materials in this collection span most of Grey&apos;s career after their partnership. The digital collection includes photographs and images of awards and ephemera,https://www.ijc.uidaho.edu/grey_al/,2023-12,2023-12,255,,published,true,IJC; Jazz,International Jazz Collections,images,"University of Idaho (Library); Moscow, ID;",46.7274,-117.01412,1989,2000,,,https://objects.lib.uidaho.edu/ijc/grey_al/ijc_al_grey_218.jpg,https://objects.lib.uidaho.edu/ijc/grey_al/small/ijc_al_grey_218_sm.jpg,https://objects.lib.uidaho.edu/ijc/grey_al/thumbs/ijc_al_grey_218_th.jpg,a drawing of Al Grey playing the trombone,https://www.ijc.uidaho.edu/grey_al/items/ijc_al_grey_218.html,https://www.ijc.uidaho.edu/grey_al/assets,https://github.com/uidaholib/ijc-collection-template/tree/grey_al,"ijcag"
arbornotes,Arbor Notes Collection,,"A collection of newsletters pertaining to the University of Idaho's Arboretum and Botanical Garden, including reports, gardening tips, and other information.",https://www.lib.uidaho.edu/digital/arbornotes/,2024-02,2024-02,57,,published,true,U of I; Campus; Agriculture,,documents,"University of Idaho (Arboretum); Moscow, ID;",46.722532,-117.014779,1980,2017,,,https://objects.lib.uidaho.edu/media/arboretum.jpg,https://objects.lib.uidaho.edu/media/thumbs/arboretum_th.jpg,https://objects.lib.uidaho.edu/media/small/arboretum_sm.jpg,Arboretum in Fall,https://www.lib.uidaho.edu/media/digital/arboretum.jpg,https://www.lib.uidaho.edu/digital/arbornotes/assets,https://github.com/uidaholib/documents-digital-collections-template/tree/arbornotes,"arbornotes"
archivalidaho,Archival Idaho Photograph Collection,,"Collected by Dennis Baird over several years and many trips to government archives and described by Idaho native Jordan Wrigley, the Archival Idaho Photograph Collection features some of the earliest extant photographs of Idaho, as well as countless other historical gems related to our fine state.",https://www.lib.uidaho.edu/digital/archivalidaho/,2023-12,2023-12,1169,,published,true,Idaho,,images,,,,1873,1999,,,https://objects.lib.uidaho.edu/archivalidaho/archivalidaho265.jpg,https://objects.lib.uidaho.edu/archivalidaho/small/archivalidaho265_sm.jpg,https://objects.lib.uidaho.edu/archivalidaho/thumbs/archivalidaho265_th.jpg,A photograph of a cowboy in the Stanley Basin with the Sawtooth Range in the background,https://www.lib.uidaho.edu/digital/archivalidaho/items/archivalidaho265.html,https://www.lib.uidaho.edu/digital/archivalidaho/assets,https://github.com/uidaholib/base-digital-collections-template/tree/archivalidaho,"archivalidaho"
archiveswest,Archives West,,A database containing finding aids from the University of Idaho and other organizations throughout the Pacific Northwest.,https://archiveswest.orbiscascade.org/search.php?r=idu,,,902,,published,,U of I; Idaho,,documents,"University of Idaho (Library); Moscow, ID;",46.72748,-117.01396,1861,2023,,,https://webpages.uidaho.edu/library/spec/harvester/objects/167276694898_0.jpg,https://webpages.uidaho.edu/library/spec/harvester/objects/small/167276694898_0_sm.jpg,https://webpages.uidaho.edu/library/spec/harvester/objects/thumbs/167276694898_0_th.jpg,"Library Special Collections, second floor",https://harvester.lib.uidaho.edu/collection/items/lumber188.html,,,
argonautphotos,Argonaut Photograph Collection,,"Over 700 photographs from the University of Idaho newspaper, The Argonaut.",https://www.lib.uidaho.edu/digital/argonautphotos/,2023-12,2023-12,702,,published,true,Idaho; Campus; U of I; Sports,Campus Collections,images,"University of Idaho; Moscow, ID;",46.728347,-117.007264,1980,1988,,,https://objects.lib.uidaho.edu/argonautphotos/argonautphotos405.jpg,https://objects.lib.uidaho.edu/argonautphotos/small/argonautphotos405_sm.jpg,https://objects.lib.uidaho.edu/argonautphotos/thumbs/argonautphotos405_th.jpg,Two students sitting on a bench on the Admin Lawn.,https://www.lib.uidaho.edu/digital/argonautphotos/items/argonautphotos405.html,https://www.lib.uidaho.edu/digital/argonautphotos/assets,https://github.com/uidaholib/campus-collections-template/tree/argonautphotos,"p17254coll3"
barstock,Barnard-Stockbridge Photograph Collection,,"The Barnard-Stockbridge Collection exhibits over 1000 photographs, selected from over 200,000 nitrocellulose and glass plate negatives, taken by Nellie Stockbridge and T. N. Barnard during the years 1894-1964. The photos depict various aspects of life in the Wallace/Kellogg mining area.",https://www.lib.uidaho.edu/digital/barstock/,2023-12,2023-12,1208,true,published,true,Idaho; Mining; Fire,,images,"Wallace, ID; Kellogg, ID; Burke, ID; Mullan, ID; Wardner, ID; Cataldo, ID; Silver Valley area in Idaho; Coeur'Alene, ID; Lolo Pass, MT;",47.474095,-115.927939,1886,1964,,,https://objects.lib.uidaho.edu/barstock/barstock94.jpg,https://objects.lib.uidaho.edu/barstock/small/barstock94_sm.jpg,https://objects.lib.uidaho.edu/barstock/thumbs/barstock94_th.jpg,"Hercules Mill, Burke (Idaho), 1907",https://www.lib.uidaho.edu/digital/barstock/items/barstock94.html,https://www.lib.uidaho.edu/digital/barstock/assets,https://github.com/uidaholib/base-digital-collections-template/tree/barstock,"bar-stock"
blackhistory,Black History at the University of Idaho,,"Research, essays and scholarship from the Black History Research Lab",https://www.lib.uidaho.edu/blackhistory/,2022-02,2022-02,620,,published,,Idaho; U of I; Black History; Sports,,documents; images; videos,"University of Idaho; Moscow, ID;",46.728347,-117.007264,1898,2022,,,https://objects.lib.uidaho.edu/blackhistory/small/ma2000_29_001_sm.jpg,https://objects.lib.uidaho.edu/blackhistory/small/ma2000_29_001_sm.jpg,https://objects.lib.uidaho.edu/blackhistory/thumbs/ma2000_29_001_th.jpg,Jennie Eva Hughes' handwritten registration card for 1899 for the University of Idaho.,https://www.lib.uidaho.edu/blackhistory/items/ma2000_29_001.html,https://www.lib.uidaho.edu/blackhistory/assets,https://github.com/uidaholib/bhrle2_source,
lchsphotos,Bovill Historical Photograph Collection,,Photographs from the collection of the Latah County Historical Society,https://www.lib.uidaho.edu/digital/lchsphotos/,2023-12,2023-12,153,,published,true,Idaho; Latah County,,images,"Latah County, ID",46.732824,-116.99744,1904,2000,,,https://objects.lib.uidaho.edu/lchsphotos/lchsphotos72.jpg,https://objects.lib.uidaho.edu/lchsphotos/small/lchsphotos72_sm.jpg,https://objects.lib.uidaho.edu/lchsphotos/thumbs/lchsphotos72_th.jpg,People on Bovill's Main Street,https://www.lib.uidaho.edu/digital/lchsphotos/items/lchsphotos72.html,https://www.lib.uidaho.edu/digital/lchsphotos/assets,https://github.com/uidaholib/base-digital-collections-template/tree/lchsphotos,"lchsphotos"
bpf,Buddhist Peace Fellowship Digital Collection,,"Newsletters and magazines produced by the Buddhist Peace Fellowship, starting as the Buddhist Peace Fellowship Newsletter from 1979-1990 then continuing as the Turning Wheel Magazine from 1990-2010.",https://www.lib.uidaho.edu/digital/bpf/,2023-12,2023-12,102,,published,true,Newsletters; Magazines,,documents,,,,1979,2010,,,https://objects.lib.uidaho.edu/bpf/small/turningwheel-fall2004_sm.jpg,https://objects.lib.uidaho.edu/bpf/small/turningwheel-fall2004_sm.jpg,https://objects.lib.uidaho.edu/bpf/thumbs/turningwheel-fall2004_th.jpg,Turning Wheel cover Fall 2004 featuring a photograph of an antiwar march,https://www.lib.uidaho.edu/digital/bpf/items/bpf086.html,https://www.lib.uidaho.edu/digital/bpf/assets,https://github.com/uidaholib/documents-digital-collections-template/tree/bpf,
bunkerhill,Bunker Hill Labor Collection,,The Bunker Hill Labor History Collection is 463 letters of correspondence between the managers and owners of the Bunker Hill Mine &amp; Sullivan M. &amp; C. Co.,https://www.lib.uidaho.edu/digital/bunkerhill/,2023-12,2023-12,463,,published,true,Idaho; Mining; Labor,,documents,"Wardner, ID",47.523164,-116.13419,1899,1902,,,https://objects.lib.uidaho.edu/bunkerhill/small/bunkerhill14_sm.jpg,https://objects.lib.uidaho.edu/bunkerhill/small/bunkerhill14_sm.jpg,https://objects.lib.uidaho.edu/bunkerhill/thumbs/bunkerhill14_th.jpg,Forest Fire 1910 - Bunker Hill correspondence,https://www.lib.uidaho.edu/digital/bunkerhill/items/bunkerhill33.html,https://www.lib.uidaho.edu/digital/bunkerhill/assets,https://github.com/uidaholib/documents-digital-collections-template/tree/bunkerhill,"bunkerhill"
shattuck,"C. H. Shattuck, Idaho Lantern Slides, 1904-1910",,"Charles Houston Shattuck was a professor in the College of Agriculture (now Natural Resources) who initiated &apos;Arboretum Hill&apos; (now known as the Charles Houston Shattuck Arboretum). These early twentieth century slides depict the University of Idaho, as well as the wilderness of Idaho and Idaho residents&apos; attempts at domesticating it.",https://www.lib.uidaho.edu/digital/shattuck/,2023-12,2023-12,212,true,published,true,Idaho; U of I; Wilderness,,images,"Selway-Bitterroot Wilderness Region; Bitterroot Mountain, ID; University of Idaho; Moscow, ID; Packers Meadows, ID; Kaniksu National Forest, MT; Lolo Hot Springs, MT;",46.724545,-117.015397,1904,1910,,,https://objects.lib.uidaho.edu/shattuck/shattuck10.jpg,https://objects.lib.uidaho.edu/shattuck/small/shattuck10_sm.jpg,https://objects.lib.uidaho.edu/shattuck/thumbs/shattuck10_th.jpg,White Sand Lake (Idaho),https://www.lib.uidaho.edu/digital/shattuck/items/shattuck10.html,https://www.lib.uidaho.edu/digital/shattuck/assets,https://github.com/uidaholib/base-digital-collections-template/tree/shattuck,"spec_cs"
camasrailroad,Camas Prairie Railroad Time Tables,,"Time Table Documents from the Camas Prairie Railroad, operated by Northern Pacific Railway",https://www.lib.uidaho.edu/digital/camasrailroad/,2023-12,2023-12,137,,published,true,Idaho; Railroads,,documents,"Lewiston, ID",46.40733431,-116.9976104,1909,1997,,,https://objects.lib.uidaho.edu/camasrailroad/small/cprrtimetables059_sm.jpg,https://objects.lib.uidaho.edu/camasrailroad/small/cprrtimetables059_sm.jpg,https://objects.lib.uidaho.edu/camasrailroad/thumbs/cprrtimetables059_th.jpg,"Camas Prairie Railroad Co. Employees' Time Table 59 Effective January 25, 1926 12:01 A. M. ""Pacific Time"".",https://www.lib.uidaho.edu/digital/camasrailroad/items/cprr076.html,https://www.lib.uidaho.edu/digital/camasrailroad/assets,https://github.com/uidaholib/documents-digital-collections-template/tree/camasrailroad,
campusart,Campus Artwork,,An overview of the artworks owned by the University of Idaho. Many are publicly accessible.,https://www.lib.uidaho.edu/digital/campusart/,2023-12,2023-12,532,,published,true,Campus; U of I,Campus Collections,images,"University of Idaho; Moscow, ID;",46.728347,-117.007264,1400,2015,"sheet titled ""campusart artwork collection digital working copy"" https://docs.google.com/spreadsheets/d/1Viz3e2-UTP0Mwgr4-MkMuyHw_MZXGuwrp0BeaI2uLE4/edit?usp=sharing",,https://objects.lib.uidaho.edu/campusart/094664.jpg,https://objects.lib.uidaho.edu/campusart/small/094664_sm.jpg,https://objects.lib.uidaho.edu/campusart/thumbs/094664_th.jpg,triangular shaped welded steel mounted on concrete,https://www.lib.uidaho.edu/digital/campusart/items/campusart015.html,https://www.lib.uidaho.edu/digital/campusart/assets,https://github.com/uidaholib/campus-collections-template/tree/campusart,
lrcdp,Campus Planning History,,"A collection of items illustrating the University of Idaho campus development plans, from the Olmsted Brothers to Today.",https://www.lib.uidaho.edu/digital/lrcdp/,2023-12,2023-12,11,,published,true,Campus; U of I,Campus Collections,images; documents,"University of Idaho; Moscow, ID;",46.728347,-117.007264,1908,2021,,,https://objects.lib.uidaho.edu/lrcdp/lrcdp-1925.jpg,https://objects.lib.uidaho.edu/lrcdp/small/lrcdp-1925_sm.jpg,https://objects.lib.uidaho.edu/lrcdp/thumbs/lrcdp-1925_th.jpg,Image of 1997 Illustrative Plan,https://www.lib.uidaho.edu/digital/lrcdp/items/lrcdp-1925.html,https://www.lib.uidaho.edu/digital/lrcdp/assets,https://github.com/uidaholib/campus-collections-template/tree/lrcdp,
watkins,Carleton Watkins Mine Interiors Collection,,"Among the riches of the historical photograph collections of the University of Idaho Library is an oversize portfolio of eighty original Carleton E. Watkins photographs. Long considered lost, these photographs of the interior of the Anaconda Mines in Butte, Montana, were taken in 1890. They show early hard-rock mining techniques, equipment, and men deep underground.",https://www.lib.uidaho.edu/digital/watkins/,2023-12,2023-12,80,,published,true,Mining; Northwest,,images,"Butte, MT",46.036746,-112.506437,1890,1891,,,https://objects.lib.uidaho.edu/watkins/watkins62.jpg,https://objects.lib.uidaho.edu/watkins/small/watkins62_sm.jpg,https://objects.lib.uidaho.edu/watkins/thumbs/watkins62_th.jpg,historic photograph in an underground mine showing miners drilling in ore,https://www.lib.uidaho.edu/digital/watkins/items/watkins62.html,https://www.lib.uidaho.edu/digital/watkins/assets,https://github.com/uidaholib/base-digital-collections-template/tree/watkins,"watkins"
cattle,Cattle Producer's Handbook Collection,,"The Cattle Producer's Handbook is prepared by the Western Beef Resource Committee (WBRC), which consists of beef specialists, economists, range scientists, animal nutritionists, county educators, and veterinarians from the Cooperative Extension System and cattle industry.",https://www.lib.uidaho.edu/digital/cattle/,2023-12,2023-12,12,,published,true,Research; Agriculture; Environmental; Idaho; U of I,,documents,"Twin Falls, ID",42.562404,-114.460263,2014,2018,,,https://objects.lib.uidaho.edu/media/cattle64.jpg,https://objects.lib.uidaho.edu/media/thumbs/cattle64_th.jpg,https://objects.lib.uidaho.edu/media/small/cattle64_sm.jpg,three dairy cows on U of I campus,,https://www.lib.uidaho.edu/digital/cattle/assets,https://github.com/uidaholib/documents-digital-collections-template/tree/cattle,"cattle"
chatcolab,Chatcolab NW Leadership Lab Collection,,The Chatcolab Northwest Leadership Laboratory has been running each summer since 1949. Chatcolab offers a unique opportunity to build leadership by engaging in the creative planning and then sharing of a recreational experience. This collection of packets was donated by Bob Carver to the University of Idaho Library and digitized by the digital initiatives unit in 2017.,https://www.lib.uidaho.edu/digital/chatcolab/,2023-12,2023-12,65,,published,true,Idaho; Northwest; Research,,documents,"Rathdrum, ID",47.877418,-116.856805,1949,1995,,,https://objects.lib.uidaho.edu/chatcolab/small/chatcolab12_sm.jpg,https://objects.lib.uidaho.edu/chatcolab/small/chatcolab12_sm.jpg,https://objects.lib.uidaho.edu/chatcolab/thumbs/chatcolab12_th.jpg,Chatcolab Packet 1968,https://www.lib.uidaho.edu/digital/chatcolab/items/chatcolab12.html,https://www.lib.uidaho.edu/digital/chatcolab/assets,https://github.com/uidaholib/documents-digital-collections-template/tree/chatcolab,"chatcolab"
cnr,College of Natural Resources Collection,,"The College of Natural Resources (CNR) has a long-standing history, beginning in 1909 and continuing to this present day. During the expanse of 100+ years, CNR has reshaped its mission and services, thanks to the leadership and vision of its Deans. This digital collection includes a majority of materials pertaining to the album University of Idaho: College of Forestry, Wildlife and Range Sciences 1909-1984. There are a wide breadth of featured material types: documents, correspondence, brochures, pictures, journals, and video and audio files.",https://www.lib.uidaho.edu/digital/cnr,2023-12,2023-12,50,,published,true,Idaho; U of I; Research; Campus,,documents; images; videos,"University of Idaho; Moscow, ID;",46.73013211,-117.01258,1907,2009,,,https://objects.lib.uidaho.edu//cnr/ug92_box5_folder60_forestproductslab1990.jpg,https://objects.lib.uidaho.edu//cnr/small/ug92_box5_folder60_forestproductslab1990_sm.jpg,https://objects.lib.uidaho.edu//cnr/thumbs/ug92_box5_folder60_forestproductslab1990_th.jpg,researchers in the forest products lab looking at beakers,https://www.lib.uidaho.edu/digital/cnr/items/cnr032.html,https://www.lib.uidaho.edu/digital/cnr/assets,https://github.com/uidaholib/base-digital-collections-template/tree/cnr,
crbp,Columbia River Basin Project: Dam Construction in the Pacific Northwest,,"Digitized photographs pertaining to the Columbia Basin Project. Special emphasis is placed on the construction of Grand Coulee Dam, the canal systems of Central Washington, and numerous other dams in the Inland Northwest.",https://www.lib.uidaho.edu/digital/crbp/,2023-12,2023-12,456,,published,true,Dams; Construction; Water; Northwest,,images,"Grand Coulee, WA; Canal systems of Central Washington",47.959223,-118.974938,1933,1965,,,https://objects.lib.uidaho.edu/crbp/crbp1040.jpg,https://objects.lib.uidaho.edu/crbp/small/crbp1040_sm.jpg,https://objects.lib.uidaho.edu/crbp/thumbs/crbp1040_th.jpg,Man stands on siphon,https://www.lib.uidaho.edu/digital/crbp/items/crbp1040.html,https://www.lib.uidaho.edu/digital/crbp/assets,https://github.com/uidaholib/base-digital-collections-template/tree/crbp,"crbproj"
cougar-dave,Cougar Dave Collection,,"This collection includes photographs and documents related to David Lewis (i.e. Cougar Dave) and the purchase of Taylor Ranch. Also included are interviews with Jess and Dorothy Taylor, who purchased Cougar Dave's ranch, and documents regarding the University of Idaho's purchase of the property from the Taylor Family.",https://www.lib.uidaho.edu/digital/cougar-dave/,2024-07,2024-07,290,,published,true,Photographs; Letters; Records,,documents; images; videos,"University of Idaho;McCall, Idaho;Taylor Ranch;Boise, Idaho;",,,1907,2000,,,https://objects.lib.uidaho.edu/cougar-dave/mg190_b1_f7_e1-015a.jpg,https://objects.lib.uidaho.edu/cougar-dave/small/mg190_b1_f7_e1-015a_sm.jpg,https://objects.lib.uidaho.edu/cougar-dave/thumbs/mg190_b1_f7_e1-015a_th.jpg,David Lewis standing in front of a rustic log cabin,https://www.lib.uidaho.edu/digital/cougar-dave/items/cougar-dave_082.html,https://www.lib.uidaho.edu/digital/cougar-dave/,https://github.com/uidaholib/base-digital-collections-template/tree/cougar-dave,
craigmountain,Craig Mountain Lumber Company,,Blueprints and correspondence from the Craig Mountain Lumber Company and Sawmill.,https://www.lib.uidaho.edu/digital/craigmountain/,2023-12,2023-12,104,,published,true,Idaho; Construction; Correspondence; Lumber; Sawmill,,images; documents,"Winchester, ID",46.27108553300317,-116.62763261160573,1904,1980,,,https://objects.lib.uidaho.edu/craigmountain/MG12_F24b_p003.jpg,https://objects.lib.uidaho.edu/craigmountain/small/MG12_F24b_p003_sm.jpg,https://objects.lib.uidaho.edu/craigmountain/thumbs/MG12_F24b_p003_th.jpg,"blueprint for stack, breeching, and stack screen system at Craig Mountain Lumber Co.",https://www.lib.uidaho.edu/digital/craigmountain/items/craigmountain046.html,https://www.lib.uidaho.edu/digital/craigmountain/assets,https://github.com/uidaholib/base-digital-collections-template/tree/craigmountain,
ctrl-shift,CTRL+SHIFT,,"CTRL+SHIFT is an online collection of audio recordings, transcripts, process visualizations, and data analyses broken out from interviews conducted with 11 prominent contemporary American poets from across the United States. The project examines recent changes in writing practices that occurred due to the advent of the computer and the arrival of the digital age and investigates new modes of working with and publishing data from qualitative interview studies.",https://ctrl-shift.org/,,,,,published,,Poetry; Research; Oral History,CDIL,documents; images; videos,"Los Angeles, CA; Cambridge, MA; Irvine, CA; New York, NY; Moscow, ID; Liberty Lake, WA; Ashland, OR; Long Beach, CA; Cambridge, MA; Bellingham, WA; San Diego, CA;",,,2013,2018,,,https://objects.lib.uidaho.edu/media/mcmichael.jpg,https://objects.lib.uidaho.edu/media/thumbs/mcmichael_th.jpg,https://objects.lib.uidaho.edu/media/small/mcmichael_sm.jpg,,https://ctrl-shift.org/flotsam/photos/mcmichael.html,,https://github.com/ctrlshifty/ctrlshifty.github.io,
gillespie_dizzy,Dizzy Gillespie Collection,,This collection was assembled by Special Collections and Archives of the University of Idaho Library with materials donated by Mrs. Gillespie. The collection contains fifteen items that belonged to the artist.,https://www.ijc.uidaho.edu/gillespie_dizzy/,2023-12,2023-12,18,,published,true,IJC; Jazz,International Jazz Collections,memorabilia,"University of Idaho (Library); Moscow, ID;",46.72732,-117.01412,1987,2000,,,https://objects.lib.uidaho.edu/ijc/gillespie_dizzy/ijc_dizzy_007.jpg,https://objects.lib.uidaho.edu/ijc/gillespie_dizzy/small/ijc_dizzy_007_sm.jpg,https://objects.lib.uidaho.edu/ijc/gillespie_dizzy/thumbs/ijc_dizzy_007_th.jpg,Plaster Mask,https://www.ijc.uidaho.edu/gillespie_dizzy/items/ijc_dizzy_007.html,https://www.ijc.uidaho.edu/gillespie_dizzy/assets,https://github.com/uidaholib/ijc-collection-template/tree/gillespie_dizzy,"ijcdg"
cheatham,Doc Cheatham Collection,,"Music, memories, and photographs of jazz trumpeter Doc Cheatham",https://www.lib.uidaho.edu/digital/cheatham/,2023-12,2023-12,63,,published,true,IJC; Jazz,International Jazz Collections,images; documents,,,,1892,1997,ijc,,https://objects.lib.uidaho.edu/cheatham/jazzfestf10-001.jpg,https://objects.lib.uidaho.edu/cheatham/small/jazzfestf10-001_sm.jpg,https://objects.lib.uidaho.edu/cheatham/thumbs/jazzfestf10-001_th.jpg,Black and white photo of Doc Cheatham playing trumpet in front of a microphone,https://www.lib.uidaho.edu/digital/cheatham/items/cheatham049.html,https://www.lib.uidaho.edu/digital/cheatham/assets,https://github.com/uidaholib/base-digital-collections-template/tree/cheatham,
